{
  "$schema": "http://json-schema.org/draft-07/schema#",
  "type": "object",
  "properties": {
    "owner": {
      "type": "string",
      "allOf": [
        {
          "pattern": "^@[\\w-]+$"
        }
      ]
    },
    "name": {
      "type": "string",
      "allOf": [
        {
          "pattern": "^[\\w-]+$"
        }
      ]
    },
    "version": {
      "type": "string"
    },
    "description": {
      "anyOf": [
        {
          "type": "string"
        },
        {
          "type": "null"
        }
      ]
    },
    "keywords": {
      "anyOf": [
        {
          "type": "array",
          "items": {
            "type": "string"
          }
        },
        {
          "type": "null"
        }
      ]
    },
    "repository": {
      "anyOf": [
        {
          "type": "string"
        },
        {
          "type": "null"
        }
      ]
    },
    "homepage": {
      "anyOf": [
        {
          "type": "string"
        },
        {
          "type": "null"
        }
      ]
    },
    "license": {
      "anyOf": [
        {
          "type": "string"
        },
        {
          "type": "null"
        }
      ]
    },
    "bugs": {
      "anyOf": [
        {
          "type": "string"
        },
        {
          "type": "null"
        }
      ]
    },
    "authors": {
      "anyOf": [
        {
          "type": "array",
          "items": {
            "type": "object",
            "properties": {
              "name": {
                "type": "string"
              },
              "email": {
                "anyOf": [
                  {
                    "type": "string"
                  },
                  {
                    "type": "null"
                  }
                ]
              },
              "url": {
                "anyOf": [
                  {
                    "type": "string"
                  },
                  {
                    "type": "null"
                  }
                ]
              }
            },
            "required": ["name"],
            "additionalProperties": false
          }
        },
        {
          "type": "null"
        }
      ]
    },
    "type": {
      "type": "string",
      "enum": ["pack"]
    },
    "skills": {
      "anyOf": [
        {
          "type": "object",
          "additionalProperties": {
            "type": "string"
          }
        },
        {
          "type": "null"
        }
      ]
    },
    "commands": {
      "anyOf": [
        {
          "type": "object",
          "additionalProperties": {
            "type": "string"
          }
        },
        {
          "type": "null"
        }
      ]
    },
    "mcp-servers": {
      "anyOf": [
        {
          "type": "object",
          "additionalProperties": {
            "type": "string"
          }
        },
        {
          "type": "null"
        }
      ]
    }
  },
  "required": ["owner", "name", "version", "type"],
  "additionalProperties": false
}
